{
  "status": "proceed",
  "outcome": "marker_split",
  "mode": "final",
  "full_diff": {
    "reviewability_status": "block",
    "evidence_path": "specs/prsg-013-reviewability-markers/.process/emission/final-reviewability.json"
  },
  "marker_plan": {
    "valid": true,
    "fingerprint_matched": true,
    "marker_count": 3
  },
  "emission": {
    "route": "hazard_collapsed",
    "markers": [
      {
        "id": "full-spec",
        "review_order": 1,
        "packet_path": "specs/prsg-013-reviewability-markers/.process/emission/full-spec/marker-packet.json"
      }
    ]
  },
  "warnings": [
    {
      "code": "HAZARD_COLLAPSE",
      "severity": "warning",
      "message": "Atomicity route requires a single PR.",
      "source": "atomicity-route",
      "details": {
        "route": "single-atomic-PR",
        "releasable": true
      }
    }
  ]
}
