{"status":"stop","outcome":"correctness_stop","mode":"final","full_diff":{"reviewability_status":"exception","gate_exit_code":0,"reason":"reviewable LOC 1322 exceeds warn threshold 400; production files 14 exceeds warn threshold 6; total files 55 exceeds warn threshold 15; primary surfaces 6 exceeds warn threshold 1","metrics":{"reviewable_loc":1322,"production_files":14,"total_files":55,"primary_surface_count":6,"primary_surfaces":["API","docs/process","other","scheduler/runtime","schema/migration","seed/config"],"greenfield":false,"thresholds":{"warn":{"reviewable_loc":400,"production_files":6,"total_files":15,"primary_surfaces":1},"block":{"reviewable_loc":800,"production_files":8,"total_files":25,"primary_surfaces":1}},"warnings":["reviewable LOC 1322 exceeds warn threshold 400","production files 14 exceeds warn threshold 6","total files 55 exceeds warn threshold 15","primary surfaces 6 exceeds warn threshold 1"],"blockers":["reviewable LOC 1322 exceeds block threshold 800","production files 14 exceeds block threshold 8","total files 55 exceeds block threshold 25"]},"evidence_path":"/var/folders/jp/nt5kjq_11m3fvxg9ftwjjqsw0000gn/T//final-reviewability-gate.4cC8PI"},"marker_plan":{"valid":false,"fingerprint_matched":false,"marker_count":0,"marker_order":[],"status":"missing","evidence_path":"specs/doc-014-seo-and-ai-discoverability/.process/autopilot-state.json","source_fingerprint":{}},"emission":{"route":"marker_split","markers":[]},"warnings":[{"code":"MARKER_PLAN_MISSING","severity":"error","message":"Autopilot state does not contain top-level pr_marker_plan.","source":"final-reviewability-backstop","details":{"feature_dir":"specs/doc-014-seo-and-ai-discoverability"}}]}
